"BarCode_No","Schedule_Date","Time","WH","DB_Type","Destination","SLCARS","Expedition_Name","Fleet_Type","Fleet_CBM"
"140121004","01/20/2014","19:00:00","JBK5+Murinda","DALKOT","Kebun jeruk - MERPATI PANCARAN KINASIH, PT",4445,"DEXTRAN","CDD",17.74
"140121012","01/21/2014","08:00:00","Murinda","DALKOT","Pasar Minggu - ALIF ROSE, PT",4642,"MITRA TOTAL PERSADA, PT","CDD",17.74
"140121013","01/21/2014","08:00:00","Murinda","DALKOT","Kebun jeruk - DINAMIKA BINTANG KEJORA, PT",371,"PUTRA BANGKA EXPRESS, PT","CDD",17.74
"140121021","01/21/2014","10:00:00","JBK5+Murinda","LUKOT","Bengkulu - MALAHO BANGKAHULU PERDANA, PT",4642,"MITRA TOTAL PERSADA, PT","FUSO",39.00
"140121031","01/21/2014","11:00:00","JABABEKA 5","LUKOT","Medan",133,"DIVISI ARMADA PINTUSONA","BUILT UP",52.00
